{
  "$schema": "https://json-schema.org/draft/2020-12/schema",
  "$id": "https://opshub.example/contracts/schemas/hub-envelope-v1.json",
  "title": "HubEnvelopeV1",
  "type": "object",
  "additionalProperties": false,
  "required": ["messageId", "version", "type", "timestamp", "payload"],
  "properties": {
    "messageId": { "$ref": "#/$defs/Uuid" },
    "version": { "const": 1 },
    "type": {
      "type": "string",
      "enum": ["JOB_OFFERED", "JOB_PROGRESS", "TEST_RESULT", "HEARTBEAT"]
    },
    "timestamp": { "$ref": "#/$defs/Timestamp" },
    "payload": { "type": "object" }
  },
  "allOf": [
    {
      "if": { "properties": { "type": { "const": "JOB_OFFERED" } } },
      "then": { "properties": { "payload": { "$ref": "#/$defs/JobOfferedPayload" } } }
    },
    {
      "if": { "properties": { "type": { "const": "JOB_PROGRESS" } } },
      "then": { "properties": { "payload": { "$ref": "#/$defs/JobProgressPayload" } } }
    },
    {
      "if": { "properties": { "type": { "const": "TEST_RESULT" } } },
      "then": { "properties": { "payload": { "$ref": "#/$defs/TestResultPayload" } } }
    },
    {
      "if": { "properties": { "type": { "const": "HEARTBEAT" } } },
      "then": { "properties": { "payload": { "$ref": "#/$defs/HeartbeatPayload" } } }
    }
  ],
  "$defs": {
    "Uuid": { "type": "string", "format": "uuid" },
    "Revision": { "type": "integer", "minimum": 1 },
    "Timestamp": { "type": "string", "format": "date-time" },
    "FieldStatus": {
      "type": "string",
      "enum": ["PASSED", "WARNING", "FAILED", "UNABLE_TO_CHECK", "INVALID"]
    },
    "OperationStatus": {
      "type": "string",
      "enum": ["DRAFT", "VALIDATING", "VALIDATION_FAILED", "VALIDATED", "GENERATING", "GENERATION_FAILED", "READY_FOR_APPROVAL", "APPROVED", "QUEUED", "RUNNING", "PASSED", "FAILED", "ERROR"]
    },
    "TestCaseStatus": {
      "type": "string",
      "enum": ["PENDING", "READY", "RUNNING", "PASSED", "FAILED", "ERROR"]
    },
    "TestResultStatus": {
      "type": "string",
      "enum": ["PASSED", "FAILED", "ERROR"]
    },
    "ErrorCategory": {
      "type": "string",
      "enum": ["ASSERTION_FAILURE", "INFRASTRUCTURE", "TIMEOUT", "CONFIGURATION", "UNKNOWN"]
    },
    "TemplateParametersV1": {
      "type": "object",
      "additionalProperties": false,
      "required": ["oaName", "thumbnailUrl", "expectedHeader", "expectedBody", "expectedButtonText", "expectedRedirectUrl", "expectedRedirectDomain"],
      "properties": {
        "oaName": { "type": "string", "minLength": 1 },
        "thumbnailUrl": { "type": "string", "format": "uri" },
        "expectedHeader": { "type": "string", "minLength": 1 },
        "expectedBody": { "type": "string", "minLength": 1 },
        "expectedButtonText": { "type": "string", "minLength": 1 },
        "expectedRedirectUrl": { "type": "string", "format": "uri" },
        "expectedRedirectDomain": { "type": "string", "minLength": 1 }
      }
    },
    "TestCase": {
      "type": "object",
      "additionalProperties": false,
      "required": ["testCaseId", "oaOrder", "oaName", "order", "templateId", "templateVersion", "parameters"],
      "properties": {
        "testCaseId": { "$ref": "#/$defs/Uuid" },
        "oaOrder": { "type": "integer", "minimum": 1 },
        "oaName": { "type": "string", "minLength": 1 },
        "order": { "type": "integer", "minimum": 1, "maximum": 5 },
        "templateId": {
          "type": "string",
          "enum": [
            "android-oa-delivery-v1",
            "android-thumbnail-v1",
            "android-content-v1",
            "android-button-text-v1",
            "android-redirect-v1",
            "web-oa-delivery-v1",
            "web-thumbnail-v1",
            "web-content-v1",
            "web-button-text-v1",
            "web-redirect-v1"
          ]
        },
        "templateVersion": { "type": "integer", "minimum": 1 },
        "parameters": { "$ref": "#/$defs/TemplateParametersV1" }
      }
    },
    "OrderedTestCases": {
      "description": "N groups of exactly 5 test cases, one group per OA, grouped by oaOrder (ascending, contiguous from 1). Within each group, `order` runs 1-5 with a fixed templateId per position - see ORDERED_TEST_CASE_TEMPLATE_IDS in local-hub/src/opshub_hub/models.py and the equivalent check in ExecutionServiceContractTest for the position->templateId mapping enforced in code (not fully expressible in pure JSON Schema across group boundaries).",
      "type": "array",
      "minItems": 5,
      "items": { "$ref": "#/$defs/TestCase" }
    },
    "JobOfferedPayload": {
      "type": "object",
      "additionalProperties": false,
      "required": ["executionId", "idempotencyKey", "revision", "platform", "testCases", "leaseToken"],
      "properties": {
        "executionId": { "$ref": "#/$defs/Uuid" },
        "idempotencyKey": { "type": "string", "minLength": 1 },
        "revision": { "$ref": "#/$defs/Revision" },
        "platform": { "enum": ["ANDROID", "WEB"] },
        "testCases": { "$ref": "#/$defs/OrderedTestCases" },
        "leaseToken": { "$ref": "#/$defs/Uuid" }
      }
    },
    "JobProgressPayload": {
      "type": "object",
      "additionalProperties": false,
      "required": ["executionId", "testCaseId", "status", "message"],
      "properties": {
        "executionId": { "$ref": "#/$defs/Uuid" },
        "testCaseId": { "$ref": "#/$defs/Uuid" },
        "status": { "$ref": "#/$defs/TestCaseStatus" },
        "message": { "type": "string" }
      }
    },
    "TestResultPayload": {
      "type": "object",
      "additionalProperties": false,
      "required": ["executionId", "testCaseId", "attempt", "status", "durationMs", "errorCategory"],
      "properties": {
        "executionId": { "$ref": "#/$defs/Uuid" },
        "testCaseId": { "$ref": "#/$defs/Uuid" },
        "attempt": { "type": "integer", "minimum": 1 },
        "status": { "$ref": "#/$defs/TestResultStatus" },
        "durationMs": { "type": "integer", "minimum": 0 },
        "errorCategory": {
          "anyOf": [
            { "$ref": "#/$defs/ErrorCategory" },
            { "type": "null" }
          ]
        },
        "errorMessage": {
          "anyOf": [
            { "type": "string" },
            { "type": "null" }
          ]
        }
      }
    },
    "HeartbeatPayload": {
      "type": "object",
      "additionalProperties": false,
      "required": ["deviceReady", "runnerReady"],
      "properties": {
        "deviceReady": { "type": "boolean" },
        "runnerReady": { "type": "boolean" }
      }
    }
  }
}
