{
  "messageId" : "17e9a479-cc66-4f0b-84d3-1c6b31fba404",
  "version" : 1,
  "type" : "JOB_OFFERED",
  "timestamp" : "2026-07-27T09:43:09.430288Z",
  "payload" : {
    "executionId" : "dbeb84ac-5859-494e-b963-c270106f322f",
    "idempotencyKey" : "fixture-idempotency-key",
    "revision" : 1,
    "platform" : "ANDROID",
    "testCases" : [ {
      "testCaseId" : "9fa73c69-74e1-4dd5-b085-e4021d61f04a",
      "oaOrder" : 1,
      "oaName" : "OA One",
      "order" : 1,
      "templateId" : "android-oa-delivery-v1",
      "templateVersion" : 1,
      "parameters" : {
        "expectedBody" : "Body 1",
        "expectedHeader" : "Header 1",
        "expectedButtonText" : "Open 1",
        "thumbnailUrl" : "https://example.test/thumb-1.png",
        "oaName" : "OA One",
        "expectedRedirectDomain" : "business1.example.test",
        "expectedRedirectUrl" : "https://business1.example.test/offer"
      }
    }, {
      "testCaseId" : "d23f714a-79ec-440a-943c-56eb41beb013",
      "oaOrder" : 1,
      "oaName" : "OA One",
      "order" : 2,
      "templateId" : "android-thumbnail-v1",
      "templateVersion" : 1,
      "parameters" : {
        "expectedBody" : "Body 1",
        "expectedHeader" : "Header 1",
        "expectedButtonText" : "Open 1",
        "thumbnailUrl" : "https://example.test/thumb-1.png",
        "oaName" : "OA One",
        "expectedRedirectDomain" : "business1.example.test",
        "expectedRedirectUrl" : "https://business1.example.test/offer"
      }
    }, {
      "testCaseId" : "18125542-299b-445f-abc0-5ddb9e249b71",
      "oaOrder" : 1,
      "oaName" : "OA One",
      "order" : 3,
      "templateId" : "android-content-v1",
      "templateVersion" : 1,
      "parameters" : {
        "expectedBody" : "Body 1",
        "expectedHeader" : "Header 1",
        "expectedButtonText" : "Open 1",
        "thumbnailUrl" : "https://example.test/thumb-1.png",
        "oaName" : "OA One",
        "expectedRedirectDomain" : "business1.example.test",
        "expectedRedirectUrl" : "https://business1.example.test/offer"
      }
    }, {
      "testCaseId" : "3f9f6bbd-98e3-4e8f-b0fa-85515b6384cb",
      "oaOrder" : 1,
      "oaName" : "OA One",
      "order" : 4,
      "templateId" : "android-button-text-v1",
      "templateVersion" : 1,
      "parameters" : {
        "expectedBody" : "Body 1",
        "expectedHeader" : "Header 1",
        "expectedButtonText" : "Open 1",
        "thumbnailUrl" : "https://example.test/thumb-1.png",
        "oaName" : "OA One",
        "expectedRedirectDomain" : "business1.example.test",
        "expectedRedirectUrl" : "https://business1.example.test/offer"
      }
    }, {
      "testCaseId" : "49152ee4-120c-4f18-9de0-24e9681fbea1",
      "oaOrder" : 1,
      "oaName" : "OA One",
      "order" : 5,
      "templateId" : "android-redirect-v1",
      "templateVersion" : 1,
      "parameters" : {
        "expectedBody" : "Body 1",
        "expectedHeader" : "Header 1",
        "expectedButtonText" : "Open 1",
        "thumbnailUrl" : "https://example.test/thumb-1.png",
        "oaName" : "OA One",
        "expectedRedirectDomain" : "business1.example.test",
        "expectedRedirectUrl" : "https://business1.example.test/offer"
      }
    }, {
      "testCaseId" : "4bd79e4e-c389-49de-9df4-1694944cd0fb",
      "oaOrder" : 2,
      "oaName" : "OA Two",
      "order" : 1,
      "templateId" : "android-oa-delivery-v1",
      "templateVersion" : 1,
      "parameters" : {
        "expectedBody" : "Body 2",
        "expectedHeader" : "Header 2",
        "expectedButtonText" : "Open 2",
        "thumbnailUrl" : "https://example.test/thumb-2.png",
        "oaName" : "OA Two",
        "expectedRedirectDomain" : "business2.example.test",
        "expectedRedirectUrl" : "https://business2.example.test/offer"
      }
    }, {
      "testCaseId" : "d86825e4-58a3-498d-8b60-b8201cb439f5",
      "oaOrder" : 2,
      "oaName" : "OA Two",
      "order" : 2,
      "templateId" : "android-thumbnail-v1",
      "templateVersion" : 1,
      "parameters" : {
        "expectedBody" : "Body 2",
        "expectedHeader" : "Header 2",
        "expectedButtonText" : "Open 2",
        "thumbnailUrl" : "https://example.test/thumb-2.png",
        "oaName" : "OA Two",
        "expectedRedirectDomain" : "business2.example.test",
        "expectedRedirectUrl" : "https://business2.example.test/offer"
      }
    }, {
      "testCaseId" : "e73726de-46cc-4792-8e2a-785891c83f41",
      "oaOrder" : 2,
      "oaName" : "OA Two",
      "order" : 3,
      "templateId" : "android-content-v1",
      "templateVersion" : 1,
      "parameters" : {
        "expectedBody" : "Body 2",
        "expectedHeader" : "Header 2",
        "expectedButtonText" : "Open 2",
        "thumbnailUrl" : "https://example.test/thumb-2.png",
        "oaName" : "OA Two",
        "expectedRedirectDomain" : "business2.example.test",
        "expectedRedirectUrl" : "https://business2.example.test/offer"
      }
    }, {
      "testCaseId" : "9ea05210-7ba1-410b-9f41-9d1f4a6a750e",
      "oaOrder" : 2,
      "oaName" : "OA Two",
      "order" : 4,
      "templateId" : "android-button-text-v1",
      "templateVersion" : 1,
      "parameters" : {
        "expectedBody" : "Body 2",
        "expectedHeader" : "Header 2",
        "expectedButtonText" : "Open 2",
        "thumbnailUrl" : "https://example.test/thumb-2.png",
        "oaName" : "OA Two",
        "expectedRedirectDomain" : "business2.example.test",
        "expectedRedirectUrl" : "https://business2.example.test/offer"
      }
    }, {
      "testCaseId" : "da2a3e3a-edc1-4a7a-bad0-b1edeb1ff569",
      "oaOrder" : 2,
      "oaName" : "OA Two",
      "order" : 5,
      "templateId" : "android-redirect-v1",
      "templateVersion" : 1,
      "parameters" : {
        "expectedBody" : "Body 2",
        "expectedHeader" : "Header 2",
        "expectedButtonText" : "Open 2",
        "thumbnailUrl" : "https://example.test/thumb-2.png",
        "oaName" : "OA Two",
        "expectedRedirectDomain" : "business2.example.test",
        "expectedRedirectUrl" : "https://business2.example.test/offer"
      }
    } ],
    "leaseToken" : "94f2335d-8346-4919-9e1a-c578af8af628"
  }
}